{"candidate": "loop-baseline", "changed_layer": null, "changed_files": [], "rationale": "Baseline for the improve loop: the agent with the kept Part C prompt change, no new edit.", "development_score": 0.875, "write_pass_5": null, "decision": "baseline", "git_commit": "63ea693a2ca9c771e2843ec1f33e0cf3d9a37b0e", "result_file": "optimize/results/development-loop-baseline-openai_rl-muse-spark-1-3-sglang-playground-20261005-124740.json"}
{"candidate": "loop-1-act-on-announcement", "changed_layer": "prompt", "changed_files": ["agent/agent.py"], "rationale": "Three mid-task stops since the prompt change: the agent announced its next lookup and ended the turn. Tie the announcement to the tool call and scope 'then stop' to a fully answered request.", "development_score": 0.875, "write_pass_5": null, "decision": "revert", "git_commit": "8da0beb530c347e985c3891be9bcc0f232a78766", "result_file": "optimize/results/development-loop-1-act-on-announcement-openai_rl-muse-spark-1-3-sglang-playground-20261005-131045.json", "note": "No mid-task stop this run, but e-009 issued the refund (queued above $100) and said a human would review it without calling escalate_to_human. Score did not improve on 0.875."}
{"candidate": "loop-2-esc5-before-refund", "changed_layer": "prompt", "changed_files": ["agent/agent.py"], "rationale": "In two of three completed post-change e-009 runs the agent issued the refund, let the tool queue it, and said a human would review it without calling escalate_to_human. State ESC-5 in the prompt: escalate before issuing or promising a refund at or above the threshold; the queue is not an escalation.", "development_score": 1.0, "write_pass_5": null, "decision": "rerun before keeping", "git_commit": "43387ea133f5be2d0b22b4d65d64d29a83af8c6f", "result_file": "optimize/results/development-loop-2-esc5-before-refund-openai_rl-muse-spark-1-3-sglang-playground-20261005-132856.json", "note": "One-case gain (0.875 -> 1.0); e-009 escalated before any refund. Rerun unchanged per the skill rule on small gains."}
{"candidate": "loop-2-esc5-before-refund-rerun", "changed_layer": "prompt", "changed_files": ["agent/agent.py"], "rationale": "Confirming rerun of loop-2-esc5-before-refund, unchanged.", "development_score": 1.0, "write_pass_5": null, "decision": "keep", "git_commit": "43387ea133f5be2d0b22b4d65d64d29a83af8c6f", "result_file": "optimize/results/development-loop-2-esc5-before-refund-rerun-openai_rl-muse-spark-1-3-sglang-playground-20261005-140539.json", "note": "1.0 again; e-009 escalated before any refund in both runs. Kept. The score cannot improve further, so the loop stops."}
{"candidate": "loop-3-act-on-announcement-with-esc5", "changed_layer": "prompt", "changed_files": ["agent/agent.py"], "rationale": "The first final development run of the kept agent stopped mid-task in e-001 and e-009 after announcing a lookup (about five stops in twenty refund conversations since the prompt change), so the score was not at its ceiling. Re-add attempt 1's sentence on top of attempt 2.", "development_score": 1.0, "write_pass_5": null, "decision": "rerun before keeping", "git_commit": "03d09a5d496e5d105e3911b7982c35789771b704", "result_file": "optimize/results/development-loop-3-act-on-announcement-with-esc5-openai_rl-muse-spark-1-3-sglang-playground-20261005-154008.json", "note": "1.0 with no mid-task stop: e-001 refunded and answered, e-009 escalated before any refund. Gain over the 0.875 final run is one or two cases, so rerun before keeping."}
{"candidate": "loop-3-act-on-announcement-with-esc5-rerun", "changed_layer": "prompt", "changed_files": ["agent/agent.py"], "rationale": "Confirming rerun of loop-3-act-on-announcement-with-esc5, unchanged.", "development_score": 0.875, "write_pass_5": null, "decision": "revert", "git_commit": "03d09a5d496e5d105e3911b7982c35789771b704", "result_file": "optimize/results/development-loop-3-act-on-announcement-with-esc5-rerun-openai_rl-muse-spark-1-3-sglang-playground-20261005-160023.json", "note": "e-009 stopped mid-task again ('I'll verify eligibility for order 1082.'). Attempt 3 scored 1.0 then 0.875, no reliable gain over attempt 2 (1.0, 1.0, 0.875), so it is reverted."}
{"candidate": "loop-4-finish-announced-step", "changed_layer": "harness", "changed_files": ["agent/agent.py"], "rationale": "About six mid-task stops in twenty-four refund conversations since the prompt change, and attempt 3's prompt sentence did not stop them. When a final reply's last sentence only announces a lookup, ask the model to make the call and continue (at most twice).", "development_score": 1.0, "write_pass_5": null, "decision": "rerun before keeping", "git_commit": "84ff16a2788ae88d2bf0e3dbdf6ec559d40ad218", "result_file": "optimize/results/development-loop-4-finish-announced-step-openai_rl-muse-spark-1-3-sglang-playground-20261005-161558.json", "note": "1.0. The guard fired three times (e-001, e-007, e-009) and each conversation went on to finish. e-009's first attempt hit the 300 s timeout (infrastructure, retried)."}
{"candidate": "loop-4-finish-announced-step-rerun", "changed_layer": "harness", "changed_files": ["agent/agent.py"], "rationale": "Confirming rerun of loop-4-finish-announced-step, unchanged.", "development_score": 1.0, "write_pass_5": null, "decision": "keep", "git_commit": "84ff16a2788ae88d2bf0e3dbdf6ec559d40ad218", "result_file": "optimize/results/development-loop-4-finish-announced-step-rerun-openai_rl-muse-spark-1-3-sglang-playground-20261005-164541.json", "note": "1.0 again, every conversation finished; the guard did not need to fire this run. Kept. The score cannot improve further, so the loop stops."}
