candidate,layer,predicted_effect,dev_score,write_pass_5,cost_per_100_conversations_usd,decision,git_commit,result_file
starting_version,none,Baseline: the unchanged agent.,0.875,,0.91075,keep,556bf91443c2b789548f8c1e35082030666b055e,optimize/results/development-starting-openai_rl-muse-spark-1-3-sglang-playground-20261002-161454.json
prompt_change,prompt,"Add RESP-6 (answer and stop, no closing offers), limit escalation offers to the cases policy requires, and drop 'point to what you can do instead' from the refusal rule. Expect e-001 to flip to pass and e-002 and e-004 to stay pass; risk that the agent stops making the required escalation on e-009.",1.0,,0.980638,keep,075eb0bf226af40dbf49eb826bbb325d863ca976,optimize/results/development-prompt_change-openai_rl-muse-spark-1-3-sglang-playground-20261005-093611.json
tool_change,tool,"check_return_eligibility adds exception_available=false and a note that a closed window is final, so the agent stops offering a human review of an exception (the most common unnecessary escalation, e.g. support-0010). Built on the kept prompt change. Expect the score to stay at 1.0 and no meaningful change in dev replies, because no dev case checks an order whose window has closed. Observed: 0.875; e-009 stopped mid-task before calling the changed tool (endpoint under load), so the drop is not the change. A support-0010 spot check found 0/3 exception offers with the prompt change alone and 0/3 with the tool change, so it adds nothing measurable.",0.875,,0.815762,revert,52b4796e475067daeda13c000d9c39e5f013a38b,optimize/results/development-tool_change-openai_rl-muse-spark-1-3-sglang-playground-20261005-100749.json
harness_change,harness,"A final-reply check in build_agent drops trailing unrequested offers (closing offers, and offers of a human, ticket, or exception when the agent did not escalate) before the reply leaves; confirmation questions and real escalations are kept. Built on the kept prompt change. Expect the score to stay at 1.0 and dev replies to be unchanged, because the prompt change already removed the offers the check catches; the risk is the check deleting a sentence it should keep. Observed: 0.875; e-009 refunded and said a human would follow up without calling escalate_to_human, a tool decision the reply check cannot touch. No measurable benefit on dev because the prompt change had already removed the offers.",0.875,,0.87295,revert,12397933776645438661bd2645dff5d960cbece8,optimize/results/development-harness_change-openai_rl-muse-spark-1-3-sglang-playground-20261005-122507.json
